<?xml version="1.0"?>
<!--***********************************************************
 * 
 * Licensed to the Apache Software Foundation (ASF) under one
 * or more contributor license agreements.  See the NOTICE file
 * distributed with this work for additional information
 * regarding copyright ownership.  The ASF licenses this file
 * to you under the Apache License, Version 2.0 (the
 * "License"); you may not use this file except in compliance
 * with the License.  You may obtain a copy of the License at
 * 
 *   http://www.apache.org/licenses/LICENSE-2.0
 * 
 * Unless required by applicable law or agreed to in writing,
 * software distributed under the License is distributed on an
 * "AS IS" BASIS, WITHOUT WARRANTIES OR CONDITIONS OF ANY
 * KIND, either express or implied.  See the License for the
 * specific language governing permissions and limitations
 * under the License.
 * 
 ***********************************************************-->


<!--<!DOCTYPE converters SYSTEM "converter.dtd">-->
<converters>
    <converter type="staroffice/sxw" version="1.0">
        <converter-display-name>
            XSLT Transformation 
        </converter-display-name>
        <converter-description>
	    Converter which performs xslt transformations
        </converter-description>
        <converter-vendor>Apache OpenOffice</converter-vendor>
        <converter-class-impl>
	          org.openoffice.xmerge.converter.xml.xslt.PluginFactoryImpl
	</converter-class-impl>
	<converter-xslt-serialize>
	       sofftohtml.xsl
	</converter-xslt-serialize>
	<converter-xslt-deserialize>
	       htmltosoff.xsl
	</converter-xslt-deserialize>
        <converter-target type="text/html" />
    </converter>
</converters>

